Review-Text,Review-Date,Star-Rating,Web-Site
"Kia Seltos is a very nice car, it is so comfortable car in over-all looks the cars the car is amazing and great, has got many features in this price which in general offered in cars above 40 lakhs price range. It is a great pick. My Friend took a test drive and to see him explaining the feature and driving experience was something I recall almost e...Read More","Nov 07, 2019",5,cardekho.com
"The car Kia Seltos is best in class it gives full value for money. The car is good looking as well, alloys of the car are superb The car has captured a good market in India. Read More","Nov 08, 2019",5,cardekho.com
"Kia Seltos is a nice car with superb features in this segment, like sunroof, HUD (DISPLAY), Cruise control, 360 degree camera, left & right side turn with came view, tyre pressure monitoring, wireless charger, digital air quality display at the rear, front driver power seat, LED light and many amazing features in GT model. Read More","Nov 07, 2019",5,cardekho.com
Listen I don't have Kia Seltos but my uncle has and after driving it I can say that it is the best car in its segment and more I never got any issues while driving it. It has great speakers and the display is awesome. One thing I can say that its sports mode is better than any other car I drove. Read More,"Nov 06, 2019",5,cardekho.com
"It is a good car, however, price is a bit high for diesel models. Looks of the car are awesome. Nice interior along with the fantastic handling. ","Nov 07, 2019",4,cardekho.com
Kia Seltos is a Great Car. Good Performance. Feel like Luxurious. Milage of the car is very good on the highway. It's almost 17 and in city it's 9 to 10.,"Nov 06, 2019",5,cardekho.com
Kia Seltos is a  very good looking car and nice future. Kia car provides great safety and easy to drive the car.,"Nov 07, 2019",4,cardekho.com
"I was planning to buy a new car. Typically, SUV. I took a test drive for harrier, MG Duster, Creta... Found harrier to be overall sufficing all parameters that ""I"" expect in my car. Then, ce in kia seltos and once i test drove it, I was sold completely.. the features are top-notch ..the range of variant is annoyingly large but it helps to be picky ...Read More","Nov 02, 2019",4,cardekho.com
I have purchased KIA Seltos on the previous month. I am fully satisfied with this car. Driving and suspension are very comfortable and smooth gear transmission also.,"Nov 07, 2019",5,cardekho.com
Kia Seltos is an awesome SUV. Design and look are excellent. I loved its look and design. And features are pretty good in slots.,"Nov 07, 2019",5,cardekho.com
An Amazing car with best features available as compared to other cars available in a similar segment with BSVI engine. Car's looks are good but not sure about the service network of this car. Read More,"Nov 06, 2019",5,cardekho.com
Have a stunning look from outside as well as inside. Comfortable and safety are better than compared to all other cars.. Felt in love with this car and good performance.  Read More,"Nov 06, 2019",5,cardekho.com
"Nice car, this car is just like magic no other company in the world of cars can compare their car with Kia company firstly I thought that MG is better than Kia but I was wrong. Read More","Oct 29, 2019",5,cardekho.com
Amazing road presence and excellent pricing strategy by Kia which entered the Indian market with a Bang. The petrol variants in the HTX series is the total value for money. Whereas the GTX variants are priced inappropriately. Read More,"Oct 27, 2019",4,cardekho.com
"Kia Seltos is a very nice car and fun to drive, new and young design, well equipped with useful tech and features. It is the best value package car in the market for a small family that offers good design in exterior and interior. Interiors have many but useful features for daily use like ventilated seats, a 10-inch infotainment system, and many ot...Read More","Oct 26, 2019",5,cardekho.com
Best in its segment and touching a record. Best in class features and ac no 1 and Kia means a powerful vehicle.,"Oct 29, 2019",5,cardekho.com
"Seltos is a good vehicle, driving smooth, the long run is comfortable.","Oct 29, 2019",5,cardekho.com
Kia Seltos is a Fantastic car. Fantastic design and looks. High-performance engine.,"Oct 28, 2019",5,cardekho.com
The Seltos is an amazing car to buy and it is one of the most comfortable cars in this price range and one more thing this is only one car that offers such functions at this price. Read More,"Oct 27, 2019",5,cardekho.com
"The cabin feels luxurious. The sound system is also good. Overall, the experience is very generous. The car offers best in class features with a very competitive price. The only competitor of this car is Hyundai Creta(Top model) Seltos beats every car in its segment but personally comparing the top models of Seltos and Creta makes it to the front. Read More","Oct 27, 2019",5,cardekho.com
The best Hi-tech car will be a bomb in the market the best in its segment with all latest features of future the style the exterior the interior handling all a class kia seltos will blow the car market in this affordable rate with best features loaded in this car the curves of car finish and seats are very comfortable. Read More,"Oct 30, 2019",5,cardekho.com
"Perfect car for the perfect India as everyone going for creta but its better than creta in comparison to features and handling performance this is a perfect rival for all other 4 meters plus SUV. According to budget and features, htx should be the choice of variant Read More","Oct 29, 2019",5,cardekho.com
Kia has debuted in the Indian car market by launching a great car. Though this car is based upon Hyundai Creta. The riding is comfortable. The styling and handling are good. The mileage could be a drawback. This is a great car. The designing and looks are fantastic. The refinement is excellent. The ride quality is superb and easily comparable to th...Read More,"Oct 24, 2019",5,cardekho.com
"Kia has launched its first car in SUV segment that is Kia Seltos. Kia launched the car at a very competitive price of SUV segment. SUVs nowdays actually preferd in Indian auto market. Kia has completely given a good design to Seltos, after being an owner of seltos you actually do not need to make any changes like changing rear lights, tail lights a...Read More","Oct 17, 2019",4,cardekho.com
"Kia Seltos is a new mid-size SUV. I am currently loving it as it's loaded with features like sunroof, touchscreen infotainment system and many more. It has sufficient space for 5 people. The sporty and bulky looks make it more awesome. I think the price is a bit high for this car otherwise, it's worthy to buy. Read More","Oct 23, 2019",5,cardekho.com
"Kia Seltos is a car that is made with a unique design. This car has been the most awaited compact SUV. It has become the most selling car by crossing over 50,000 bookings in the past 3 months. Kia Seltos is a feature-loaded car by providing the bose speakers, heads up display, ambient lighting, etc. This car has been the most successful car in its ...Read More","Oct 19, 2019",5,cardekho.com
The cost of the Kia Seltos is very good and the interiors are of top-notch quality and did not feel the cheap quality. Even the base model also has good quality interior. The GT line version of the car has a very good engine and it has all the high-end features which we cannot see in its rivals. This made the seltos a very good option among its riv...Read More,"Oct 17, 2019",5,cardekho.com
"Its been 15 days on Kia Seltos GTx+ Petrol, its a wonderful car with excellent features. Turbo engine picks up very fast (100 KMPH in 9-10 secs). On highways it just smoothly flies. Some of the features are really very good like when you switch on the signal to turn, you get a view of that side in your dashboard from the camera even covering blind ...Read More","Oct 14, 2019",5,cardekho.com
The car is a tech paradise. The bose speakers provide incredible audio. All the technology in this car is really new for India. If it had an electric variant that would be the coolest car in India. All of this comes at a great price. It is like a quintessential car for a family of 5. It can be used in all kinds of terrain. It is more attractive and...Read More,"Oct 26, 2019",5,cardekho.com
"I took delivery of Kia Seltos diesel automatic and before I reached home driving 15 Kms, I encountered the following issues: 1. Burning smell from hornet, 2. Oil spill over engine cover, 3. Excessive heat from front grill When I asked my dealer , he was cool enough to tell I will raise an issue with his service department.  Read More","Oct 15, 2019",1,cardekho.com
This is an awesome car in the segment. The interior is superb. The looks are nice. The seating is comfortable. It is a spacious car. ,"Oct 24, 2019",5,cardekho.com
"Kia Seltos has nice dual-tone lavish interior, functional dashboard, powerful steering and many more good features.","Oct 22, 2019",5,cardekho.com
"Kia Seltos is the best car available in the segment with bose surround speakers, 360 camera with high resolution, electronically adjustable seats, sunroof, packed up with safety feature and it also has several engine option depending on the choice of the customer and with the elegant interior option with dual-tone dashboard and more. Though sharin...Read More","Oct 09, 2019",5,cardekho.com
"The driving experience of Seltos GT 1.4 Turbo petrol with DCT is commendable. It handles very well on highways, around corners and manages easily while overtaking in city drive. Infotainment system has got apple android car play and interface is really good compared to Hector. The quality of fit and finish is very good compared with any car even ab...Read More","Oct 10, 2019",5,cardekho.com
"Kia Seltos is an excellent car and features are also very good. The exterior design is very awesome and important thing is a lot of variants are available. For a low end, middle end and top end all people can enjoy while buying this car. Only one thing, the waiting period is a little bit more. Read More","Oct 08, 2019",5,cardekho.com
"Indians almost forgot what SUV means, Kia Seltos may have some premium features but lacks 4X4 or AWD. Without these features off road, riding is almost not possible. Coming to pricing it is overly priced, just by adding around 10% to the top end variant we can get true SUV like Mahindra XUV 5OO which is also a 7 seater. So I personally feel going f...Read More","Oct 13, 2019",1,cardekho.com
Kia Seltos is a beautiful car wuth nice interiors at a decent price. ,"Oct 11, 2019",5,cardekho.com
"Kia Seltos is a superb car. With all great specs and full features, the car has everything. Just loved it. The car is amazing, it is going to be a great car for Indian people in this range. Read More","Oct 10, 2019",5,cardekho.com
"What a wonderful Car Kia Seltos is! I drove BMW 5 series as a test drive. I was so impressed, I thought no other car can match the power of BMW. I must truly say Kia Seltos GTX+ DCT is the best of all cars. Such amazing drive with endless features. People were stopping me on the road to know about Kia Seltos. At Night it gives another beautiful fee...Read More","Oct 08, 2019",5,cardekho.com
"Kia Seltos is a very nice car, it has good space and driving comfort. The 1.4 lit petrol engine gives a highway mileage of 17.8Kmpl.","Oct 08, 2019",5,cardekho.com
"Kia Seltos is very comfortable. Nice family car, mileage is also very good. There are more advanced features like rear shade mirror, etc.","Oct 11, 2019",5,cardekho.com
Kia Seltos is the best car. A great alternative to other cars in the segment. Way more feature-loaded than any other rival. Superb ride quality and handling.,"Oct 10, 2019",5,cardekho.com
"Worst car ever I have experienced. Price is too much, you get better features even at a lesser price. It has the worst interior plastic quality. I myself owned the Kia Seltos HTK Plus variant. You can't drive at night the fog is putting up very fast very disappointed with this car. Read More","Oct 08, 2019",1,cardekho.com
"Kia Seltos is the future, Kia has added each an everything that a car needs, the cabin is comfortable and is the best thing of the car. There's nothing to dislike in the cabin it gives a luxurious feeling and the instrument cluster gives a bold, sassy look to interior and the black finish looks best. The plastic quality is also good, boot space is ...Read More","Oct 07, 2019",5,cardekho.com
"Kia Seltos has classy looks, better engine, with new BS6 norms. Having a turbocharged engine with great power. Awesome driving experience.","Oct 07, 2019",5,cardekho.com
"Kia Seltos is overall power-packed performance. In the era of cheap and best, it is quality and best. Many of the segment first features are alluring. The interior takes your heart away at once. The exterior is the least of your concern, as it catches your eyes from a very far away distance. The ride quality is better than Creta, and it can beat Cr...Read More","Oct 06, 2019",5,cardekho.com
The Seltos has awesome looks and interiors also. The car is best for all SUV and tail light is also different from other cars.,"Oct 06, 2019",5,cardekho.com
Kia's first offering will go up against some tough competition. Our 1st look at the Kia Seltos seems to suggest it will do more than just fine in this bunch. The engine is already bs 6 compatiable and they will run perfectly in the present fuel also. The seltos is Kia's 1st made in India product. And its a prety impressive vehicle on the inside and...Read More,"Oct 07, 2019",5,cardekho.com
"The Kia Seltos is a superb car, best choice I like the pickup, excellent light, and good service.","Oct 05, 2019",5,cardekho.com
"Kia Seltos is a feature boosted car, but all the features are available in the petrol GT line 1.4 Ltr turbocharged engine and only one diesel top variant engine. They could give some of the features in lower variants also. Read More","Oct 03, 2019",3,cardekho.com
"Driving HKT+, value for money. Nothing is missing in interiors. Mileage on the highway is around 26-29/L, in diesel. Rear seats are spacious for three persons.","Oct 03, 2019",5,cardekho.com
Excellent build quality and best features offered in this price range. No one offered this type of feature in this price range.,"Oct 02, 2019",5,cardekho.com
"Kia Seltos is the best car, in this car you get all the features that a normal customer requires, but if you are going for higher variants then you get more luxury features but talking about base models, the car performs well. Now talking about top models you get all the luxury features which high-end users want, the sporty look of the car makes it...Read More","Oct 01, 2019",5,cardekho.com
"Kia Seltos is nice SUV overall, it has nice height and design and it tyre is so nice it reflects even if we go to sun it is nice car and it is a foreign company and car colour is so nice overall it has projector headlights offers by Kia motors and it has seven airbags on top model Kia Seltos is the future Kia has added everything. Read More","Oct 01, 2019",5,cardekho.com
"I saw lots of people cribbing about how Kia has come up with weak engines or price is little high, it's a mid-size SUV which competes with Creta, kicks, Duster, Ecosport with tech line of Seltos and if you want better performance you can go with gt line. I am getting 1.5-litre petrol a one above base model of 11 lakhs. It has a good engine. 5 peopl...Read More","Oct 01, 2019",5,cardekho.com
"Kia motors forayed into the Indian market with a full bang on preparations and made a product which is worth applause. The driving dynamics are spot on, features are well loaded like 360* parking camera, 7 inch heads up display, ventilated seats, air purifier. You name it and Kia seltos have it. The engines are really great but the showstopper is t...Read More","Sep 30, 2019",5,cardekho.com
"Kia Seltos has superb interior and great display screen. Great color options available and looks stunning as well. Its give a royal look on Indian roads. The height of the car and the ground clearance is superb for indian roads. Apart from great looks, its engine is smooth and cabin noise is super silent. In the end, a car is very unique and one of...Read More","Sep 29, 2019",5,cardekho.com
The Kia Seltos is so amazing the looks are extravagant. The front end of the Seltos is particularly impressive. The huge tiger-nose grille is Kia's design trademark. The quality levels of the Seltos of both versions of the car that we tested are simply phenomenal. Read More,"Sep 29, 2019",5,cardekho.com
"Kia Seltos is the best budget car with amazing features and looks like a luxurious car. I love the inbuilt car, air purifier, headlights are also good, very comfortable car and the red colour of the car looks amazing. Kia has debuted in the Indian car market by launching a great car. Read More","Oct 02, 2019",5,cardekho.com
"This Kia Seltos gonna be game-changer in the automotive industry because it is gonna win the hearts of every Indian car lovers through its stylish and sporty look. And the Kia company is very known for their cars as they are stronger, trusted and performer in the automotive industry in the world. Thank you. Read More","Sep 30, 2019",5,cardekho.com
"WhenKia came up with its new model seltos every one was excited and when it was launched by a bulk of features and it was a success for Kia. Kia Seltos is a very good engineered vehicle with all new features that we need in our day to day life like keyless entry, Connected car, etc. It has croosed more than 35,000 happy customers. Read More","Sep 29, 2019",5,cardekho.com
"The Kia seltos is best to other cars, and the look of this car is great and the feature of the car is very important to others cars, and this car compares the other SUV cars this car performance is also very good and I saw all the version of this car is very good medium people also got this car. Read More","Sep 30, 2019",5,cardekho.com
"Most of the new and smart features given in Kia Seltos at a reasonable price. 1.smart air purifiers 2.head up display. 3.360camera view. Massive look with all led headlamp DRLS and turn indicators. The UVO Connected car same as bluelink, it has 10.5 inches smart display with apple car play and more. Diamond cut alloy wheels. Comfortable interi...Read More","Sep 24, 2019",5,cardekho.com
"Kia Seltos is the best upmarket vehicle, basically, Kia is known for his world-class design and the material quality used is excellent. Fit-finish and the placement of the infotainment system high up in the driver's line of sight with 10.2-inch touchscreen is outstanding. Here Kia Seltos offers a powered driver's seat, ventilated front seats, ambie...Read More","Sep 25, 2019",5,cardekho.com
"Kia Seltos is the future, Kia has added each an everything that a car needs, the cabin is comfortable and is the best thing of the car. There's nothing to dislike in the cabin it gives a luxurious feeling and the instrument cluster gives a bold, sassy look to interior and the black finish looks best. The plastic quality is also good, boot space is ...Read More","Sep 25, 2019",5,cardekho.com
"The five-seat SUV is Kia's first model for India and has the task of establishing the Korean carmaker in our market. It does have the right ingredients for the job. The Seltos is attractive, keenly priced and comes with a wide range of engine and gearbox options. On offer are 1.5-litre petrol, 1.4-litre turbo-petrol and 1.5-litre diesel engines, ea...Read More","Sep 27, 2019",5,cardekho.com
"Kia Seltos is the best car in the market. This car is clearly overtaken her rivals like creta, harrier, nexa . Super. Getting all the features like a led lamp, super comfort seat, led screen for media and Gps etc, adjustable steering and seats, sunroof for more luxuries feel to drive this beast. Super smooth driving experience with powerful engine ...Read More","Sep 26, 2019",5,cardekho.com
"2 airbags are the minimum safety but even the top variants of HT line get the 2 airbags only, it is very disappointing. HTX+ diesel automatic whose ex-showroom price is 16lakh has only 2 airbags. This a deal-breaker for anyone looking for diesel automatic SUV. Kia provides a lot of fancy features but when it comes to essentials they lag. Read More","Sep 26, 2019",1,cardekho.com
"Kia Seltos has very bad quality interiors plastic, front grill is of plastic. The inner space id good, good seat comfort, and the pick up is good in petrol model.","Sep 29, 2019",2,cardekho.com
"Kia Seltos has an excellent performance, superb design, best in features, smooth drive, best price range and comfort.","Sep 27, 2019",5,cardekho.com
"Kia Seltos : Speakers are not of good quality, very low volume, running is very good, mileage awesome, smooth and easy to drive, lights are the best part, but annoyed to see the volume of speakers. Read More","Sep 25, 2019",3,cardekho.com
"Kia Seltos is an excellent car. It has many features that we all want. In today's time, we need everything luxury so this car is also a luxury car. This car is stylish. It has good audio system with a good touchscreen and has ventilated seats.  Read More","Sep 24, 2019",5,cardekho.com
Kia is one of my favorite cars. I love the road presence of the car and the comfort level of the car. The touch screen system is superb huge and smooth to use. Seats are very much comfortable and there is a huge amount of knee room and headroom present in the car. Boot space is perfect for a long-distance. Read More,"Sep 23, 2019",5,cardekho.com
Kia Seltos is the best in class. A complete package for a family. Love the design and the interior design is out of the world. The driving pleasure is so comfortable. The best in the class boss audio system. It roles like a lion just too much fun riding with this machine. No doubts about the vehicle. Kia you've done a great job and helped people to...Read More,"Sep 22, 2019",5,cardekho.com
The best car in this segment than the Creta and special thing is that this car is equipped with a Bose stereo system which is top-notch.,"Sep 23, 2019",5,cardekho.com
I test drove the Kia Seltos car and found it had very good in a pickup with a smooth drive. I was quite worried as I had canceled the MG Hector petrol automatic as I was not happy with the pick up and prebooked Seltos. The features are really awesome besides being smaller in size it is a great city car. The mileage also I have been told is signific...Read More,"Sep 22, 2019",5,cardekho.com
"Best design car in the market, and gives a premium feel. The material which is used to make the interior is also very premium and good. At last, the car is very good.","Sep 20, 2019",5,cardekho.com
"I got GTX+ petrol manual amazing car driving experience, full of features fully loaded It's really a vehicle would satisfy you to the extreme.","Sep 20, 2019",5,cardekho.com
"Good looking car as compared with other SUVs, best in class and seriously I love this car.","Sep 19, 2019",5,cardekho.com
"The car was best in driving, Comfort, and safety. Feels like premium SUV. The sports version of Kia is absolutely fantastic. The best in the feature. The interior and exterior of the car are well designs. The grill of the car looks attractive. And the best part of the car is the BOSE sound system. To be honest the best feature in the car I liked it...Read More","Sep 19, 2019",5,cardekho.com
"The Seltos has a nice car with a nice look, good interior looks and I love the make, design, and interior of the car.","Sep 19, 2019",5,cardekho.com
The design is marvellous. The design is very different from all the mini SUVs in India. Keep up the fire.,"Sep 19, 2019",4,cardekho.com
"I test drove Kia Seltos HTX+ 1.5L Diesel AT- simply loved the vehicle. Driving was too easy and comfortable. The noise level was nearly zero, difficult to distinguish between petrol and diesel engine by its' sound. HTX+ 1.5L Diesel is missing in some advanced features such as 360 camera, HUD and 6 air-bags vis-a-vis GTX+ variant. However, GTX+1.5L ...Read More","Sep 17, 2019",5,cardekho.com
Kia Seltos is value for money SUV. Its stylish exterior and luxurious interior features added great value to it. Overall looks and design is really class in the segment. Enhanced BS 6 power of engine surprised you. Maximum care has been taken to integrate safety features like airbags and ABS etc. Certainly you will feel pleasure to have it. Undoubt...Read More,"Sep 17, 2019",5,cardekho.com
Kia Seltos is good but diesel engine should be more powerful and the price is also expensive because the middle-class family can only extend their budget to 14lakh and the expensive price of cars is the reason behind the auto sector low sales auto industry should think about Indian middle-class family. Read More,"Sep 17, 2019",3,cardekho.com
"Kia Seltos is overpriced in featured variants and tech line features are not good to enjoy the vehicle. Boxy looks of the dashboard are not good, interior color combinations are not available, not luxurious interior. If we are driving near a hundred , mileage is coming down drastically. Families need sunroof for kids enjoyment and 6 airbags which a...Read More","Sep 17, 2019",3,cardekho.com
I recently bought a Kia Seltos and I feel it was the best decision ever. This car exceeded all my expectations for a car in this price range. The interior quality is damn good. I picked up a diesel car and it's pretty smooth. The seats are super comfortable. There is a lot of leg space. I would recommend this car to everyone. Read More,"Sep 17, 2019",5,cardekho.com
Awesome design comes with good pricing. The most amazing part is the GT line. But KIA should focus on increasing the number of dealers in the city like Nagpur.,"Sep 18, 2019",5,cardekho.com
