Review-Text,Review-Date,Star-Rating,Web-Site
"The car looks like SUV but not the real SUV. The petrol engine never makes any noise but here I can see unexpected things. IVT is lazy. Manual petrol and 1.4 is good. Diesel major looks difference from petrol even the grill and the bumper not matching with. Petrol 1.4 and diesel have all the disc brake, not the other petrol. Bose speaker is only av...Read More","Dec 12, 2019",3,cardekho.com
"Very excellent car, the look of the car is impressive and the ride and handling quality is awesome. The interior of the car is so classy, every look of car is so commendable. The color combinations of the car are too good. The alloy of car is mind-blowing and boot space is very much spacious. Read More","Dec 12, 2019",5,cardekho.com
Very good car with a fantastic front look and have a great boot space. Have sufficient leg space at the back.,"Dec 11, 2019",5,cardekho.com
"Fully feature-loaded SUV. Kia has done excellent work for Indian customers. 5-star for its look, features, and performance.","Dec 11, 2019",5,cardekho.com
"I'm driving the Kia Seltos HTK+ Diesel model. Overall the car is best. I have driven it 6500kms, but still no issue. Pick up is great. Mileage is around 21kms also best on bad roads. The car is best on curve road to have great grip. Infotainment is good. Some issues with Android Auto gets disconnected within1hr. But with a software update, it will ...Read More","Dec 11, 2019",5,cardekho.com
It's a pleasure to sit in the car and treats me like a king.,"Dec 11, 2019",5,cardekho.com
Smooth driving and luxurious car.,"Dec 11, 2019",5,cardekho.com
"Satisfying ride, comfortable seats, powerful beast. I tried other cars in the same price range but no one was comforting as this one.","Dec 11, 2019",4,cardekho.com
Most popular car in the world because of looks. Its look is very good and has many features that contain In-car 50-liter storage to fill tanks and many features. This car drives smoothly and this car is best for buying. Read More,"Dec 11, 2019",5,cardekho.com
I just bought the one but the mileage of the car is not satisfactory. It doesn't give more than 12km/ltr.,"Dec 11, 2019",4,cardekho.com
"New in the Indian market, Kia Seltos is everything that one needs in a mid-size SUV. Value for money, indeed.","Dec 11, 2019",4,cardekho.com
"Good car with the futuristic and latest tech, appealing to masses especially gen x,y, and z. Looks sturdy, has road presence and a differentiator when runs on the road, a masculine look which is attracting most of the young people. Multiple variants and both manual and auto transmission options make it a top seller. The only area where it needs to ...Read More","Dec 11, 2019",4,cardekho.com
"It's a good looking car, nice performance, comfort level is good and luxurious. The interior is very attractive and of good quality.","Dec 11, 2019",4,cardekho.com
"Fantastic tuned engine, hi-tech entertainment system, great build quality, comfortable seats and decor, first time ever air filters in the car and brilliant suspension. I have been driving Seltos HTX Diesel for 1000 km now and the car never ceases to surprise. More airbags could have helped and the rear seat could have been a bit longer for support...Read More","Dec 11, 2019",4,cardekho.com
"Very good car in budget with the best performance, low maintenance and undoubtedly controlling is also very well.","Dec 11, 2019",5,cardekho.com
"A very good car, in this price tag they gave all premium interiors but the only thing petrol DCT transmission heats up.","Dec 11, 2019",4,cardekho.com
These new entrants are not as per the safety norms. Only features and comprising on safety. People in India are not looking at safety ratings while purchasing a car like playing with life. This is well understood by these vehicle manufacturers and hence they are putting only features. I think safety should be first. Read More,"Dec 11, 2019",2,cardekho.com
"If we talk about the overall ratings of Seltos, no one can give a proper review. When I started the engine, the sound was so negligible that I cannot tell you the silence in the cabin. The power to thrust ratio is well explained in this Car. Even if you scale at 3rd gear. The engine seems to be smooth and amazing. I would suggest Seltos over The He...Read More","Dec 11, 2019",5,cardekho.com
"The car is great at handling and suspension is set good for the Indian roads. Good design in exterior as well as interior, The engine shows good aggressiveness in the real world. Offroad experience is good too because of the suspension and the projector headlights. The space that the car offers in the second row and in the boot is pretty good. The ...Read More","Dec 10, 2019",4,cardekho.com
"Excellent SUV with modern technology, style, performance, handling, comfort. Perfect vehicle by Kia. Impressed with the long list of features including Head's up display, Air purifier, 360 camera with the blind-spot camera. Kia plays a key role in the Indian market. Read More","Dec 10, 2019",5,cardekho.com
"Kia Seltos is providing all features in under 10 lakh price range. An awesome car as compared to other cars. Mostly, getting all the safety features in this car.","Dec 10, 2019",4,cardekho.com
Seltos is a big hit in India. Kia released their first car and got a massive hike. The horsepower and 1-liter turbo charge is just lit. It became the fourth largest car producing companies in India already. The screen in the car is just awesome and should've got panoramic sunroof competing for the MG Hector. The speed is pretty good. Read More,"Dec 10, 2019",5,cardekho.com
The best car in the segment and is quite affordable.,"Dec 10, 2019",4,cardekho.com
Great design and silent cabin with good ground clearance. Comfortable to drive for longer travel.,"Dec 10, 2019",4,cardekho.com
I had a test drive and the performance and comfort were good. The riding position should have been better.,"Dec 10, 2019",4,cardekho.com
This car is unbelievable due to its features and looks it has.,"Dec 10, 2019",5,cardekho.com
Best experience with new Kia. Fully loaded with Hi-Tech features. Enjoying the drive as this is the most amazing car ever.,"Dec 10, 2019",4,cardekho.com
A fabulous car which is very much extra-ordinary.,"Dec 10, 2019",3,cardekho.com
Really an amazing car and a very smooth car.,"Dec 10, 2019",5,cardekho.com
The Kia Seltos is a bit more expensive but offers a lot more for it in terms of safety and features. It is well worth the premium over the MG Hector,"Dec 10, 2019",5,cardekho.com
The most beautiful car than other companies currently in India. I don't know much about this company but this is the best car for everyone because this is a very powerful car and the model is very nice looking and indicators are comparing with Audi and the price is very suitable than other companies. Read More,"Dec 10, 2019",5,cardekho.com
The Kia Seltos is very excellent in looks. Its alloy wheel looks great and the front fog lamps and big headlights with DRLs looks are pretty much fascinating. This mid-size SUV is too good in this range. Kia Seltos is better than MG Hector and Hyundai Creta. Kia Seltos's front view is looking aggressive and side view of Seltos is just amazing. Read More,"Dec 10, 2019",5,cardekho.com
It looks very different as it has a sunroof and is a five-seater car. The boot space is also bigger than other cars.,"Dec 09, 2019",5,cardekho.com
"This is actually the best offering in the current price range. People have been cribbing about features, well then pay for it! You forget it's technically not an Indian company, so taxes are more! The range-topping GTX+ model which now also comes in both petrol and diesel comes with features that none of the vehicles in the current market offer. 6 ...Read More","Dec 09, 2019",5,cardekho.com
"Kia Seltos is the one in a class after much-awaiting finally release this car with all the most useful features. Kia Seltos the car with ease. The vehicle drives very smooth and you can get very attached and comfortable within its first 5 seconds of the drive. Interior is refreshing, the led wall is a gem. Smooth drive brings you comfort. Looks are...Read More","Dec 09, 2019",5,cardekho.com
"Kia Seltos is a very spacious car and the interiors are awesome. Very good ground clearance is very good. Seating capacity is 5, engine power is boosted. The pick up is very good. Mileage is ok. Read More","Dec 08, 2019",4,cardekho.com
"Best in the segment car and strongly suggest you take a good long hard look at the Kia Seltos. It's a compact SUV that looks super promising, offers a lot and from our first drive experience and felt the moment. Read More","Dec 09, 2019",5,cardekho.com
"Kia Seltos is a nice car and also getting good legroom, headroom and overall spacious car. Kia is one of the best companies which offers a passenger vehicle with all the best possible features. Read More","Dec 09, 2019",5,cardekho.com
Best in class and very cool engine and best breaking system good engine sound interior has very good finishing.,"Dec 09, 2019",4,cardekho.com
Looks are definitely the best. But it lacks good suspension. It's a little bit hard. It gives a very premium feel while I enter in it. Full of features.,"Dec 09, 2019",4,cardekho.com
"Very good car in terms of technology and ride experience, but if it was fuel electric it would have been much better.","Dec 08, 2019",5,cardekho.com
This car is really very good at having a very excellent performance. I love this car because of its awesome interior and very good features at very low rates.,"Dec 08, 2019",5,cardekho.com
Perfect car of the year loved all its features in this car. No car can beat the accessories the technology provided in this car.,"Dec 08, 2019",5,cardekho.com
I am a big fan of Kia. When I was in South Korea my brother bought a Kia optimum. When Kia launched its first car Seltos in India. I bought that. And I am very happy to buy this car. Its mileage is OMG! Very very good. The pickup is very good. It's very smooth. It looks very sharp. And it is as comfortable as a Jaguar. And successfully it is the to...Read More,"Dec 08, 2019",5,cardekho.com
"Excellent Features and at par with luxury cars like BMW and Benz etc. I was using Ford Ecosport which was much stronger than Kia Seltos. Transmission temperature increases and you are forced to stop in traffic. Except for the strength and heaviness of the car, looks-wise It is very elegant. Read More","Dec 08, 2019",4,cardekho.com
"Looking nice and has a good performance as well. One of the best SUV of the current time, autonomous and voice control are amazing.","Dec 08, 2019",5,cardekho.com
Excellent features are loaded like premium cars. The look is great and awesome Cost is very competitive in the SUV segment.,"Dec 08, 2019",5,cardekho.com
"This car is just amazing with a bunch of features and this is the best in-car segment, it is just amazing for youngsters.","Dec 08, 2019",4,cardekho.com
The interior and exterior are very nice and beautiful.,"Dec 08, 2019",5,cardekho.com
It's the best car in the price range and gives me the phenomenal performance that an SUV owner wants. It's my pleasure to have a Kia in my house. This car has an outstanding fuel economy compared to other car. The car comes with a good dynamic look and with outstanding features that will help you in your daily life. The car comes with a sunroof tha...Read More,"Dec 08, 2019",5,cardekho.com
Great features the car has. Amazing mileage and great performance.,"Dec 08, 2019",5,cardekho.com
"Well, this car is one of the best premium SUVs you can buy today, with features like air purification and the mirrors that show the side view of the car for an added layer of safety. It's the best mid-sized SUV you can buy. Interiors give it a premium look, and yes drives like a charm. Read More","Dec 08, 2019",5,cardekho.com
"Kia Seltos is the best in class, comparatively, it's not a box, the base variant is also carrying all necessary features. The music system and multifunction steering are available in all models. Read More","Dec 07, 2019",5,cardekho.com
I like every part of the Kia Seltos as the seats are very comfortable. The look is superb. The speedometer is stylish. The red colour is best Kia Seltos has multiple engine options as I want. This car is available in petrol as I want a petrol car. All engine has an automatic gearbox. The car has air purifier Car has a Bose sound system. Connect car...Read More,"Dec 07, 2019",5,cardekho.com
"Great car in the SUV segment and worth buying. The interior looks top-notch. Also, you get a smooth feeling while driving. I did a test drive and it feels wonderful. Highly recommended. Read More","Dec 07, 2019",5,cardekho.com
"Awesome car, with best in class, Bose music system and the front grill of the car is also amazing along with the day time running LED.","Dec 07, 2019",5,cardekho.com
"This car looks amazing and also has a 360-degree camera view, which is very rare.","Dec 07, 2019",5,cardekho.com
It comes with awesome features. Its automatic gear shifting is smooth and seats are very comfortable. All windows are also automatic. ,"Dec 07, 2019",5,cardekho.com
"This is a car I was looking for and the features of this car are amazing. It's comfortable on Indian roads. This car has every feature, which an ideal car should have. Not only the interior is great, but the exterior is also commendable. Read More","Dec 07, 2019",5,cardekho.com
"The car looks like a beast and the engine power is great, the Bose sound system is top-notch, and the 360-degree camera view is very helpful.","Dec 07, 2019",4,cardekho.com
The smoothest experience I have ever had was in this car. So much of class and performance in this car I just loved it.,"Dec 06, 2019",5,cardekho.com
Kia is the best car that is safe & smooth. Available at the best price.,"Dec 06, 2019",5,cardekho.com
"According to me, Kia Seltos is best. Best in Comfortable, best in mileage, best in look. In short, an amazing car.","Dec 07, 2019",5,cardekho.com
"Superb sound quality sound system and excellent future car. Mind-blowing look, low price best design. Segment 1st Smart Heads-Up Display. World's 1st SmartPure Air Purifier. Bose Premium Sound System with 8 speakers & LED Sound Mood lights with straight Line designs and World-Class Quality. Read More","Dec 06, 2019",5,cardekho.com
The look is best. And the interior is awesome And technology is mind-blowing by comparison to another car like MG Hector and others. The engine power of the KIA Seltos is best. And the drive is very smooth. The KIA Seltos have soo much Space for comfort setting.  And also have soo much function on the dashboard. The dashboard of the KIA Seltos is f...Read More,"Dec 06, 2019",5,cardekho.com
Awesome car with a Bose music system. Far better than Hyundai's Creta. Great riding experience with KIA and within the budget.,"Dec 06, 2019",4,cardekho.com
"Amazing driving experience being a cousin of Hyundai, Kia gives more money value but MG has better space and features.","Dec 06, 2019",4,cardekho.com
"Amazing features, excellent road presence with safety features and comfort within the budget.","Dec 06, 2019",5,cardekho.com
Great car with multiple features. Highly recommended.,"Dec 06, 2019",5,cardekho.com
"It's a good product from Kia. It is a great allrounder in all aspects. It's a clear rival for segment leader Creta. Seltos is a great car, balancing pocket and commendable performance. Even it proved that it's far better than India's most awaited SUV Hector from MG motors. Ultimately its a great start to Kia in India. Read More","Dec 05, 2019",5,cardekho.com
"Kia Seltos is an awesome car with a great look. Also, getting average mileage in this vehicle.  ","Dec 05, 2019",4,cardekho.com
Kia Seltos is the Beautiful Compact SUV. It is the best car in the 10 lac budget range.,"Dec 05, 2019",5,cardekho.com
"Car is very comfortable and has classy looks. I have purchased Kia Seltos GTX+ DCT in the month of October from Pune dealer. I have been around for three weeks. But since the very first day, I noticed a very annoying sound coming from rear of the vehicle. I have tried all possible things like removing all lose attachments and items from the car but...Read More","Dec 05, 2019",5,cardekho.com
"NO ONE CAN FIND A BETTER SUV THAN KIA SELTOS. ITS AMAZING LOOKS AND BODY ALIGNMENT ARE SOO GOOD AND TOUGH. INTERIORS ARE BEST OF ITS CLASS. I WOULD RECOMMEND YOU TO BRING HOME KIA SELTOS AND HAVE FUN LONG TRIPS WITH YOUR FAMILY. IT'S BEST WHEN ITS COMES TO ALL-TERRAIN, SO GIVE YOUR FAMILY A PLEASURE OF RIDING A GOD OF CHARIOTS. Read More","Dec 04, 2019",5,cardekho.com
"The car looks amazing, The DRL's are attractive and the touch screen display has a really good response; but the car couldn't get 5 stars as the speedometer and the touch display could be more stunning which would upgrade the interior to a whole another level; Even though the dual-tone interior is interesting. The design of the car will stand out a...Read More","Dec 05, 2019",4,cardekho.com
Kia Seltos is an awesome car from my experience. Good for long routes and quite spacious with comfort and relief. Happy with features of the car. Family and friends appreciated my choice and also wants always to ride my car. Read More,"Dec 04, 2019",5,cardekho.com
"The car is awesome. I bought the Seltos 1.4T GTX Plus Manual and the engine & gearbox are really smooth which delivers an unbelievable power. The cabin of the car is so well built that all the buttons and switches are at your fingertips. 360-degree camera, Blindspot view, Bose speakers, Ventilated seats and HUD makes the car superb. NVH levels are ...Read More","Dec 05, 2019",5,cardekho.com
"Amazing experience, however, a bit expensive when compared to MG Hector. It is very spacious and is affordable.","Dec 05, 2019",4,cardekho.com
Pickup and mileage are amazing. The comfort level up to the mark.,"Dec 05, 2019",5,cardekho.com
One of the best cars in 2019 by Kia. Features in the car are amazing.,"Dec 05, 2019",4,cardekho.com
"Great looks and amazing transmission features. Aux, A.C., and rear parking camera are wonderful.","Dec 05, 2019",5,cardekho.com
"DON'T BUY SELTOS: 1=WASTE OF TIME AND MONEY. 2=COST WISE HIGH-QUALITY WISE LOW. 3=MILEAGE TOO LOW. 4=I'M BUYING A GTX 7 DCT AUTOMATIC TRANSMISSION PETROL AS I HAD A LOT OF TROUBLE IN MY VEHICLE. FAULT CAN START IN BELOW MENTIONED FACTORS: 1, A.C. NOT WORKING AS WELL. 2, THE BRAKING SYSTEM IS OLDER THEN AMBASSADOR. 3, MILEAGE IS BELOW 12 KM ...Read More","Dec 04, 2019",1,cardekho.com
This car is aggressive & beautiful in this segment. This car fully loaded with features.,"Dec 04, 2019",5,cardekho.com
"Best car in its segment. Excellent drivability, superb engine, amazing ergonomics, wonderful comfort, and humongous space. The car is a total package of comfort and performance. Seats are adjustable for both driver and front passenger side. Loads of legroom for the rear passengers. Excellent boot space. Better buy than Jeep Compass or Hyundai Creta...Read More","Dec 04, 2019",5,cardekho.com
"Kia Seltos the best automotive made by Kia. It has a 7.5 to 8.1inch screen which provides car information and navigation. There is also a head-up display through which you can get essential information such as speed. It is a good car in terms of safety which carries 4 airbags in the top variant. Even in the low variant, the safety measures are amaz...Read More","Dec 04, 2019",5,cardekho.com
"Excellent car in this price as it gives great value and great comfort for long drives. Also, it is very spacious.","Dec 04, 2019",5,cardekho.com
Kia Seltos is a very good car. It has new features with a triggered mileage. It's quite comfortable within the budget.,"Dec 04, 2019",5,cardekho.com
Very nice car and superb features. It looks amazing and gives a feel which is quite comfortable.,"Dec 04, 2019",5,cardekho.com
It's an amazing experience as the drive is very much comfortable. It has many features to entertain and gives a wonderful experience to the passengers as well.,"Dec 04, 2019",4,cardekho.com
Good car with the best features within the budget. The interior and the seats of the car make it luxurious.,"Dec 04, 2019",5,cardekho.com
"Nice car with lot more features. Fully loaded with multiple features, the best features is the 360-degree camera.","Dec 04, 2019",5,cardekho.com
It was the best experience for me. I enjoyed it thoroughly.,"Dec 04, 2019",5,cardekho.com
This is the best car in my budget as the features available are amazing including the interior and the exteriors.,"Dec 04, 2019",5,cardekho.com
"Features loaded car beyond expectations. Wonderful engine, superb interior with amazing quality, fabulous fit, and world-class finish.","Dec 04, 2019",5,cardekho.com
"A very nice car with bose speakers, which is not available in other cars in its segment. Worth buying it. This car is spacious, safe, powerful. This car comes with 6 airbags, sufficient boot space, and sunroof. Ambient mood lighting gives a luxurious and soothing experience. Read More","Dec 03, 2019",4,cardekho.com
"We brought the Kia Seltos HTK in petrol 2 months ago and the car is fabulous. You get all the features even in the base variant. You name it and its there. It has a 6 speaker JBL music system, an intelligent MID projector setup for both headlamps and foglamps. It is a very nice car and you should buy it instead of its rivals. However, spare parts a...Read More","Dec 03, 2019",5,cardekho.com
"I felt very glad by its modern advanced technology and innovative design still, it's so smart due to Long-Durability, Safe, Secure and Lightweight. It's one of my favorite cars known for ""Kia Seltos"", we would feel simple by architecture style ever. Read More","Dec 03, 2019",5,cardekho.com
Best and fully loaded car. Kia Seltos is also the best value of money. This car is manageable and is luxurious.,"Dec 03, 2019",4,cardekho.com
"Very nice SUV, a great combination of comfort, features, and style. Value for money car with luxury features, good handling, and great braking.","Dec 03, 2019",5,cardekho.com
Nice design and engine are powerful and advanced. Speed and mileage are up to the mark. Available within the budget.,"Dec 03, 2019",5,cardekho.com
The best performance and unique look make it striking. The detailed review of this car can not be expressed in just a few words.,"Dec 03, 2019",5,cardekho.com
This car has a very comfortable sitting arrangement and a very good leg space.,"Dec 03, 2019",5,cardekho.com
"To be very honest this SUV has a sporty look and as per the company, it has a thrilling design, including the interior. Highly recommended.","Dec 03, 2019",4,cardekho.com
"Kia Seltos became one of the best prime SUV cars of this era in India. The car has a best-finished premium looking with ultimate build quality till now in the Indian car market. In this price range, it gives many loaded features as follows:  1. It has a 360-degree camera. 2. Both front and rear parking assistance are given. 3. Has an adequate bo...Read More","Dec 02, 2019",5,cardekho.com
"Kia as soon as it landed in India came with a bang for the buck competing with its sister company Hyundai's Creta, the Jeep Compass and the MG Hector which again was recently launched. Seltos gave us a variety of features with 2 lineups total of 5 variants that can suit your choice and has premium features. Read More","Dec 03, 2019",5,cardekho.com
"I brought Seltos HTX one week back. This is my 6th car following Innova Crysta, XUV500, Duster, Honda City, and Dzire. I can safely say that this is the best overall car in this price range presently. This car is a near-perfect vehicle by many angles. Its design is fantastic, looks are fantastic, features are amazing, refinement is excellent, NVH l...Read More","Dec 01, 2019",5,cardekho.com
"I am feeling great with this car. It has a quite good handling, nice road grip, great stability, also great acceleration, and engine noise is quite low. Talking about interiors it's just wow. Lots of space, comfortable to sit, and love the driver's electronic adjustment. Don't have words about ventilated seats, and infotainment touch is a superb th...Read More","Dec 02, 2019",5,cardekho.com
"Kia has debuted in the Indian car market by launching a great car Seltos. Though based upon Hyundai Creta, yet many steps ahead of the techology, comfort, styling ride and handling. I think mileage could be a negative aspect. Still, it's a great car. Read More","Dec 02, 2019",5,cardekho.com
"Great car with looks, mileage, power, comfort, and ultimate driving pleasure. All in all an absolute value for money car.","Dec 02, 2019",5,cardekho.com
This car is delivering a very good performance. Great looks.,"Dec 02, 2019",5,cardekho.com
Fully loaded car with super new generation features and economically best for middle-class people.,"Dec 02, 2019",5,cardekho.com
"It's the best car which I have ever seen and yes it is a new company, so some people might think to purchase it or not. My experience says that every guy must at least test drive it and I'm sure, once driven, will be bought for sure. Read More","Dec 01, 2019",5,cardekho.com
"A very comfortable and advanced feature, my friend bought this car and its superb car with great features. The engine is more powerful than my car. I like the sensors in this car. Read More","Dec 02, 2019",4,cardekho.com
"Its a nice car with great features, amazing headlight, suspension, nice pick-up.","Dec 01, 2019",5,cardekho.com
"The best thing about the car is the interior and exterior features. It is provided at such a reasonable price, and it is simply the best in its segment and it makes Seltos the best car. Read More","Dec 01, 2019",5,cardekho.com
