Review-Text,Review-Date,Star-Rating,Web-Site
"After I took the test drive of the vehicle I was fully satisfied with Kia Seltos is a complete package. It ensures a smooth drive, comfort is awesome and spacious and also the engine is powerful.its not but mini SUV car color, and design is great and also the interior are the best in the segment. Read More","Dec 28, 2019",5,cardekho.com
"Best in this segment and for the family, it can go anywhere from cities to mountains the car comes with the best comfort and features.","Dec 28, 2019",5,cardekho.com
"The infotainment system of the car is amazing, it has muscular looks with great fuel economy.","Dec 27, 2019",5,cardekho.com
"I have driven my friend Kia Seltos the experience was very good, I first noticed the power was really good I was thinking that this is a newly launched car in the market with a new company. I don't have any high expectations but this car gets above my expectations somehow the cooling of this car is very good the car is totally cooled just in 50 sec...Read More","Dec 27, 2019",5,cardekho.com
  Nice car everything is good in this car.KIA is awesome and hoping that the next car from KIA is going to be awesome ,"Dec 27, 2019",5,cardekho.com
Best segment car overall design performance everything! The car design no match to other cars in the other case this car fits on turbo engine,"Dec 27, 2019",5,cardekho.com
  The is car and drive is smooth and the interior is good looking compared to all other cars this is my opinion ,"Dec 27, 2019",4,cardekho.com
Amazing performance and great driving experience so far. Kia's debut car is performing well.,"Dec 27, 2019",4,cardekho.com
"Seltos is near perfect vehicle by many angles. Its design is fantastic, looks are fantastic, features are fantastic, refinement is excellent, NVH levels are superb, ride quality is superb and easily comparable to my Innova Crysta, diesel manual mileage is excellent, seat comfort is superb.  Read More","Dec 27, 2019",5,cardekho.com
The car is fully loaded with features and bose sound speaker and the driver seat is electrically adjustable. Engine performance is also perfect  ,"Dec 27, 2019",5,cardekho.com
Great design and the best comfort it has and is luxurious.,"Dec 27, 2019",5,cardekho.com
One of the best of 2019 car. I really love it and the interior is really awesome. The design of the car is really futuristic and gives an overall cool look.,"Dec 26, 2019",5,cardekho.com
It's a very nice car. I purchased the last two month ago. I got a very good comfortable riding and I am happy with this car.,"Dec 26, 2019",3,cardekho.com
Good car but it doesn't have much pickup but this car has best in class features so not bad.,"Dec 26, 2019",3,cardekho.com
Just Awesome car in this price range. Comfortable with good seats ... Awesome features.. Interior is very beautiful. Quality of alloys is also superb. The overall look is very good. Read More,"Dec 26, 2019",5,cardekho.com
"Its good car in every aspect. If we compare with Creta than only the height factor is concerned. Other things the company can improve its 10-inch display. Hybrid technology also keeps in as it plays a good role. Lastly, backside shape can be improved. Read More","Dec 26, 2019",4,cardekho.com
"It's a good product from the stable of Kia. Average may be an issue for some people as in bumper to bumper traffic its average is around 11-12 km and on the highway, it may go beyond 19 if driven on a constant speed of 80 without much use of the clutch. overall good car. Read More","Dec 26, 2019",4,cardekho.com
It is a too smooth and comfortable car. I just love the interior and exterior of this car and its design its interior look everything is perfect.,"Dec 26, 2019",5,cardekho.com
It's an affordable car and I like it very much. Nice SUV in this segment at this price range. I think its a perfect car.,"Dec 26, 2019",5,cardekho.com
Nice website to search about cars And many more action I really appreciate car dekho Nice job Sonu Kareem Thank you Car lover,"Dec 27, 2019",4,cardekho.com
" Best SUV of the year, the Kia Seltos is a subcompact crossover SUV built by Kia Motors. Based on the Kia SP Signature concept car, its name is derived from ""Celtos"", the son of Hercules in Greek mythology. Read More","Dec 26, 2019",5,cardekho.com
I am the proud owner of Kia. Amazing mileage and performance. The perfect SUV Car. I have really liked to build quality of the car. Go and get it.,"Dec 26, 2019",5,cardekho.com
Amazing features and excellent performance. It churns an ultimate mileage and makes this car the best car ever.,"Dec 26, 2019",5,cardekho.com
This car has been the best SUV ever I have selected It has fully come up with my expectations Bold modular design and looks are an awesome excellent response from steering Smooth ride quality Good average performance Excellent space Excellent cooling Smart air purification works perfectly Mood lights look awesome Read More,"Dec 25, 2019",5,cardekho.com
I am very much interested to buy this car. perfect SUV for small families like me. KIA just made a brilliant SUV.,"Dec 25, 2019",4,cardekho.com
"The car has an amazing performance, this car makes me happy I love this car.","Dec 25, 2019",5,cardekho.com
"I found this car amazing in its segment having an amazing interior, eye-catching color, smooth steering, and good boot space.    ","Dec 25, 2019",5,cardekho.com
This is the best car when it comes to safety features. The drive quality of the car is amazing.,"Dec 25, 2019",5,cardekho.com
"Kia Seltos is the best car with the best price, best in looks the price perfect matches with the product.","Dec 25, 2019",5,cardekho.com
The car has gorgeous design along with great performance. The interior is premium riched and it is excellent for long drives.,"Dec 25, 2019",5,cardekho.com
"Kia Seltos is the car of the year. Its design is fantastic, features are fantastic, refinement is excellent, NVH level is Superb, ride quality is superb and diesel manual mileage is excellent, seat comfort is superb, the back seat of this vehicle occupies 3 people comfortably. The drive is really convenient in heavy traffic with automatic gear and ...Read More","Dec 25, 2019",5,cardekho.com
"It is the best car under its budget, the headlamp was based on the advance concept it is full of function.","Dec 25, 2019",5,cardekho.com
Great pick up but comfort is not up to the mark and looks are also great. Better space than Creta.,"Dec 25, 2019",3,cardekho.com
"The best one when compared with others in the same segment. Also, known as a family car.","Dec 24, 2019",5,cardekho.com
"An Indian car with great safety features. Also, comfortable and the build quality is amazing.","Dec 24, 2019",4,cardekho.com
"Awesome car, great features as compared to Jeep Compass and MG Hector. Absolutely, a lovely car. Disadvantages:- 1- Suspension is not soo good, it is ok but you need to work on grip and control of the car. Advantages:- 1- Delivers ultimate mileage and has great performance. Read More","Dec 24, 2019",5,cardekho.com
"Its design is fantastic, looks are amazing, features are impressive, refinement is excellent, NVH levels are superb, ride quality is ultimate and can be easily compared to my Innova Crysta. The diesel manual mileage is excellent, seat comfort is superb. Back seat of this vehicle occupies 3 people comfortably. The boot space has enough for luggage o...Read More","Dec 24, 2019",4,cardekho.com
"Kia Seltos is not only the most feature-packed car in the segment, but it's also fun-to-drive and looks very good too.","Dec 24, 2019",5,cardekho.com
Amazing car as the interiors and the exteriors are amazing.,"Dec 23, 2019",5,cardekho.com
The real off-road car as it can be driven in the rural areas as well. It's cost-efficient and the performance is amazing.,"Dec 23, 2019",4,cardekho.com
"Excellent car in India Low budget me the high class car I love this car & my Dream car, JUST GO FOR THIS VEHICLE BLINDLY. YOU CAN PURCHASE ANY VARIANT DEPENDING UPON YOUR NEEDS, AND I CAN ASSURE YOU THAT, MOST OF YOU WILL BE VERY PLEASED TO OWN THIS VEHICLE. Go and purchase now This &#x1f607; angel car Thank Read More","Dec 23, 2019",5,cardekho.com
Wonderful comfort and features. The engine is awesome. A perfect blend of practicality and cosmetics. It has ample storage and enough room for 5 passengers. It can be called a true SUV because of the given ground clearance. Read More,"Dec 23, 2019",5,cardekho.com
"Amazing suspension and runs smoothly, however, the price is too high.","Dec 23, 2019",5,cardekho.com
Kia Seltos is a luxury car who's exterior and interior gives the feel of cars like Range Rover. It is the best car in its segment. Seltos is an efficient car for a family. Its center console is so premium and the sunroof is amazing. The Bose music system is the best thing in the car. Read More,"Dec 23, 2019",5,cardekho.com
"Kia Seltos is Superb car with excellent technology. A very nice car in this segment with all the attractive features. Also, t is the most selling after lunch.","Dec 23, 2019",5,cardekho.com
Kia Seltos is a good luxury vehicle at Valuable rate. Extraordinary front DRLS and headlight lamps. Good build quality with attractive look getting in this car. Impressing interiors provided by the brand in this car. Read More,"Dec 22, 2019",5,cardekho.com
"Firstly I think Creta is the best car in the mid SUV segment but when Kia launches its beast nothing other than Seltos. It crosses over every mid-range SUVs in the aspect of performance, looks, power, features, and many more features getting in this car. Read More","Dec 22, 2019",5,cardekho.com
"Best features and look at, best engine performance and my favorite car in 2019.","Dec 22, 2019",5,cardekho.com
Kia Seltos is not so attractive in terms of look but still most of the people like it. I rated this car at 4.5. ,"Dec 23, 2019",4,cardekho.com
Kia Seltos has all the best feature in this price range. It is a very attractive look and the most demanding car in this segment.,"Dec 22, 2019",4,cardekho.com
"Seltos, in the price, is a very good car someone can get. Everything in it is pretty good but being a new company, the after-sales service that you'll get may leave you unsatisfied. Also, suspension in it is a bit on the harder side, it pumps back the vehicle and this is the only reason I've given it 4 stars because when we buy a car, with power, l...Read More","Dec 20, 2019",4,cardekho.com
The stylish look of this car attracts so much to the people this car is impressive in its own way such a gangsta feeling when I see it moving in fast speed the interior of this car is so much classy This car gives you a royal feeling while driving and limbs of this car are excellent seats are also so comfortable this car in mid-range makes it attra...Read More,"Dec 21, 2019",4,cardekho.com
Worth Buying it. Value for money. Fully loaded with next-level features (in comparison to prevailing features in the market). Great mileage is there so you can take it to a longer distance and do good off-roading. Available in exciting colors. After-sales service is also good. If you people are looking for compact SUV that it will be one of the bes...Read More,"Dec 20, 2019",5,cardekho.com
"Seltos is near perfect vehicle by many angles. Its design is fantastic, looks are fantastic, features are fantastic, refinement is excellent, ride quality is superb and easily comparable to my Innova Crysta, diesel manual mileage is excellent, seat comfort is superb. Read More","Dec 21, 2019",5,cardekho.com
Great build quality comfort is highest on its segment You can change lanes at 140 kmph too. It feels like a heavy car but gives confidence on the road.,"Dec 21, 2019",5,cardekho.com
"Best car of the year, awesome design, good space, and interior also. Good performance was amazing with BS6 engine.","Dec 21, 2019",5,cardekho.com
"Best car, luxury car in the small budget, this is the wonderful experience best car in the world.","Dec 21, 2019",5,cardekho.com
"This car is amazing, I love the drive quality and when driving the interior design of the car is very super and the car is very nice.","Dec 21, 2019",5,cardekho.com
"It's really hard to explain, I think its good for a middle-class family and it looks like a luxury one.","Dec 20, 2019",4,cardekho.com
Excellent car superb facility inbuilt. Camera and other excellent features which we get in 30 lacs plus car.,"Dec 21, 2019",5,cardekho.com
,,,cardekho.com
,,,cardekho.com
,,,cardekho.com
,,,cardekho.com
,,,cardekho.com
,,,cardekho.com
,,,cardekho.com
,,,cardekho.com
,,,cardekho.com
,,,cardekho.com
,,,cardekho.com
,,,cardekho.com
,,,cardekho.com
,,,cardekho.com
,,,cardekho.com
,,,cardekho.com
,,,cardekho.com
,,,cardekho.com
,,,cardekho.com
,,,cardekho.com
,,,cardekho.com
,,,cardekho.com
,,,cardekho.com
,,,cardekho.com
,,,cardekho.com
,,,cardekho.com
,,,cardekho.com
,,,cardekho.com
,,,cardekho.com
,,,cardekho.com
"Very wonderful design and technical development are too high this type of car, and also so many features available in the vehicle, more options and more model, vehicle looking is good. I'm seen the car at road very nice and fantastic road presence, one of the my lovely car of this segment, thanks to KIA motors I'm waiting for next Carnival car, als...Read More","Dec 16, 2019",4,cardekho.com
This car is a very wonderfully design by Kia motors. Its headlights are very attractive and the front view of the car is very amazing. Kia Motors are giving the best function in this car of a 360-degree rotating parking camera with sunroof and also 6 airbags. The wooden finish in the interior of this car is very fabulous. Very luxurious sitting in ...Read More,"Dec 16, 2019",5,cardekho.com
It's a brilliant 5 seated car with heavy power and excellent fuel mileage. It's look is pretty awesome.,"Dec 17, 2019",5,cardekho.com
Great car to drive and good proportions. There is less body roll at the back. Superb interiors and great tech inside. I heard quite a few comments that servicing is not that great but I have never experienced such an issue. Overall it's good. Read More,"Dec 17, 2019",4,cardekho.com
"Excellent car specification, head-lamp display, alloy wheels are very good and the design is amazing.","Dec 16, 2019",5,cardekho.com
"Kia Seltos is a great car with good mileage, low maintenance cost and fully feature-loaded car. Amazing body design and perfect interior getting in this car.","Dec 16, 2019",5,cardekho.com
"Good ride quality, refined engine, and 1.4 petrol motor is a blast to drive. Build quality gives a premium feel. Nice and spacious cabin well-built car.","Dec 16, 2019",4,cardekho.com
"Nice and bold car Kia Seltos. Looking beautiful, nice shapes and aggressive looks. ","Dec 16, 2019",5,cardekho.com
"Best car with high end features in a medium budget. When this car was launched in India it beat the Tata Harrier and MG Hector but it has a common exterior design that looks like Creta. It doesn't give a fresh look. Peopld liked it because of high features in this car with some more expenses. Due to high sales in India, this company became India's ...Read More","Dec 16, 2019",4,cardekho.com
Kia Seltos is a nice car. Also getting very nice interior and exterior in this vehicle.  ,"Dec 16, 2019",5,cardekho.com
Kia Seltos is one of the topmost good cars because of his good performance and many other excellent features at a cheap price. It is a new company which enters in Indian market but set up the best and strong market in the country we should appreciate to all to members who are working for the Kia company and thanks to designer who give this the best...Read More,"Dec 15, 2019",5,cardekho.com
"Superb car, it will be a good experience to drive a car like this and it will be ruling on Indian Road in the future. The taught of innovation to make this car for Indians very thankful. The technology used in this car is best for the price tag they have. The shape is the perfect SUV in the market. The LED lights front light everything is perfectly...Read More","Dec 15, 2019",4,cardekho.com
This car is superb for mileage and looks stylish and furious. This is an awesome car.,"Dec 15, 2019",5,cardekho.com
"It is so well designed and comfortable car. I am glad to see such a car in that budget. First I had a Honda City but KIA is better than it. I and my whole family are enjoying it. It is also perfect for long journeys and from one state to another journey. I also like traveling, so I recommend all this car for travelers. Thank you. Read More","Dec 15, 2019",5,cardekho.com
"Poor suspension setup. Stiff suspension gives jerks even on smaller bumps. I am surprised why people ignored this. Suspension of Creta is better, best indeed.","Dec 15, 2019",1,cardekho.com
I have purchased Seltos HTK PLUS Diesel Automatic car is good in handling and running on roads. But there are some problems in quality car doors is very lightweight inside material is also not so premium as I was thinking. The average is also not so good. The audio system is very awesome with mood lighting features. seats are very comfortable but t...Read More,"Dec 15, 2019",4,cardekho.com
Kia is an affordable product for SUV lovers. If we are comparing Kia Seltos or Creta so Kia will definitely wins this segment.,"Dec 15, 2019",4,cardekho.com
"Kia Seltos is the next-generation car with excellent features. It's Style, Performance & interior is Luxurious. I love this car. I'm totally satisfied with this. Sporty Looks & Cool headlights make it more attractive. Also, getting good quality speakers in this car. Read More","Dec 15, 2019",5,cardekho.com
Very good car and smoothness of the car is nice and features of the car are awesome. The car looks like an SUV and nice-looking exteriors.,"Dec 15, 2019",5,cardekho.com
"Kia Seltos is a very excellent car, as it offers much more features than other cars in this price range, but its top-end model is not value for money because it offers the smaller engine as compared to its rivals. Read More","Dec 15, 2019",5,cardekho.com
Nice car with a lot of features including 360 camera facilities and lot of things which are given the first time in any vehicle in India with low cost and vehicle comfort is high and performance is also good cc is excellent and so on etc enjoy Hia motors enjoy Kia Seltos. Read More,"Dec 14, 2019",4,cardekho.com
"I have this car, it's awesome, I am using this car last three months, I haven't felt any problem and it's very good at driving and price-wise it's really good amazing features, a stylish look which makes it perfect. Read More","Dec 14, 2019",5,cardekho.com
"Seltos is good, but they need to lower the budget but the car and it is a high-class luxury car. The handling is also very smooth, pickup speed is also superb, the AC cooling is good and superb brakes. But the airbags must be more so that it will ensure safety of the people. Read More","Dec 14, 2019",5,cardekho.com
Seltos is an awesome and comfortable car with low maintenance and low price. The facilities available are good looking at high range.,"Dec 14, 2019",4,cardekho.com
This is a very nice car and the features are very good. People must buy this car. The seats are very nice as well.,"Dec 14, 2019",5,cardekho.com
"Good space and excellent comfort, safer, looks are bold and stylish. The best car in this budget for a small family.","Dec 14, 2019",5,cardekho.com
An awesome and classy car with its amazing features and beautiful and classy look. No other car in this range can give take over to Kia Seltos. This is my humble request to Kia to introduce more cars like this and keep going like this. Read More,"Dec 14, 2019",5,cardekho.com
"A compact SUV with the styling, features, and tech to really hit the sweet spot as far as what customers are looking for.","Dec 14, 2019",5,cardekho.com
Nice car with suitable features and the cost is also reasonable but the thing is availability. It's not available at all places.,"Dec 14, 2019",4,cardekho.com
"Well, a featured car with full specifications and well likable also, I love to ride this car every time and the main part is that it is suitable for every type of person. Read More","Dec 14, 2019",4,cardekho.com
"Nice car and the design was too awesome. This is the awesome entry of Kia in India. It includes a bose speaker which is too good. In India, this is a first car comes inbuilt bose speakers which are a pretty good thing about the car. The interior was also a good highlight and the exterior was also good. At this price, the car is too good. Read More","Dec 14, 2019",5,cardekho.com
"This car is a very good choice at this price, body, look, maintenance and service, everything is maintained by Kia India.","Dec 14, 2019",5,cardekho.com
The great car really with great interiors and full of new functionality which we haven't seen in any other car in India. Very much spacious and looks amazing.,"Dec 14, 2019",5,cardekho.com
"The Kia Seltos is one of the most eagerly anticipated launches for the year 2019. But before Kia Motors announces the price of the Seltos, we were invited to take the compact SUV for a spin around the streets of Goa. Read More","Dec 14, 2019",5,cardekho.com
The excellent new designs and the world's most beautiful car has already buzzed the market. ,"Dec 14, 2019",5,cardekho.com
Very nice car and very comfortable seats with powerful brakes. The interiors and its seating arrangement are also amazing. Available at affordable prices.,"Dec 14, 2019",4,cardekho.com
A very comfortable and smooth vehicle. The gear-box is very smooth.,"Dec 14, 2019",4,cardekho.com
Amazing car with ultimate colors.,"Dec 13, 2019",5,cardekho.com
Best of 2019 just because it has extra features and good looking interior and exterior design.,"Dec 13, 2019",5,cardekho.com
"Best in class, good infotainment system, smooth driving and feels like a premium one. For only who can afford it.","Dec 13, 2019",5,cardekho.com
"The Kia Seltos is good in every possible way, but there is a huge downside to the Seltos in case of pricing, where the vehicle is manufactured in Andhrapradesh the prices must be a bit low as all the other rival are priced very less in spite of manufacturing out of India. There is one thing Kia should implement which is it should provide the essent...Read More","Dec 13, 2019",3,cardekho.com
"Kia entered the Indian market with the SELTOS the one which shook the Hyundai CRETA and takes the first position in the compact SUV segment. It is offered with a 10.25-inch touchscreen display, KIA's UVO connects, air purifier, sunroof, and HUD(Heads Up Display). The car has three engine options all of them available either in manual or automatic t...Read More","Dec 13, 2019",5,cardekho.com
"Good experience while seating on driver seat. It is like, this is the car I was waiting for. It has a 4-star quality, being a middle-class 1 star less for price.","Dec 13, 2019",5,cardekho.com
The affordable SUV car is so comfortable and it has many functions. It has a sunroof as well. Also available at the cheapest rate as compared to the Venue.,"Dec 13, 2019",5,cardekho.com
I love the interior of this car This is perfect for the family and It is an affordable good looking car. The front-facing is superb.,"Dec 13, 2019",5,cardekho.com
"It's a nice car and really worth the price. It looks fantastic when it runs like a cheetah on the road. Talking about the safety of the car, absolutely safe car. Power and horsepower are really very powerful. Boot space is also very huge. Radio screen of 8 inches looks perfect and the speakers of BOSE give a clear voice and it has mood light also w...Read More","Dec 13, 2019",4,cardekho.com
"The car gets at the top speed in no time, it is a great car to get the money worth. The Seltos is amazingly featured as well.","Dec 13, 2019",5,cardekho.com
This car is very excellent in this price range because in this car there are more additional features.,"Dec 13, 2019",5,cardekho.com
Very Nice car and feels like luxurious looking XUV. Very comfortable and amazing features. ,"Dec 12, 2019",5,cardekho.com
SELTOS HAS GIVEN A BIG COMPETITION TO HYUNDAI CRETA IN THIS SEGMENT. THE KIA IS ABSOLUTELY THE KING.,"Dec 12, 2019",4,cardekho.com
"Such an Impeccable Machine with flawless drive, Indomitable power, eye-catching design, and Hushed Engine. Its a feeling of some luxury segment at very competitive pricing. Moreover Interior is just mind-blowing with such soothing acoustic sound. Pocket-friendly for all mileage concern buyers as it easily churns 18 km-22 km per liter depending on c...Read More","Dec 12, 2019",5,cardekho.com
"Wonderfull look this car has, interiors are mind-blowing. This car is fully loaded with multiple features.","Dec 12, 2019",5,cardekho.com
I had fun while test driving the demon. A good one with awesome driving excellence. Great build quality and control.,"Dec 12, 2019",5,cardekho.com
"This car is a very silent and very nice car. It has many new, useful features. Quite spacious as well.","Dec 12, 2019",5,cardekho.com
"A car that is built to conquer the mid-size SUV segment. With all the bells and whistles coming in terms of features and power(1.4 turbo petrol) combined with the variety to choose from, be it types of transmission options and varients and also color options, made to be unique for almost every masterpiece made making it an extreme value for money p...Read More","Dec 12, 2019",5,cardekho.com
"The Kia Seltos has a very different design, and very much comfortable. ","Dec 12, 2019",4,cardekho.com
Great performance with dashing looks.,"Dec 12, 2019",4,cardekho.com
